{
  "contract_name": "operator.worker_inventory.response",
  "contract_version": "1.0.0",
  "schema_version": "1.0.0",
  "taxonomy_version": "taxonomy-recon-v1",
  "tenant_id": "tenant-lab-001",
  "customer_context_id": "customer-context-main",
  "environment": "phase0_lab",
  "correlation_id": "corr:worker-inventory-001",
  "causation_id": "worker-inventory-001",
  "idempotency_key": "response:idem:worker-inventory-001",
  "producer": {"component": "supervisor", "produced_at": "2026-07-26T01:00:01Z"},
  "policy_version": "guardian-policy-lab-v1",
  "request_id": "worker-inventory-001",
  "actor_id": "operator-lab-001",
  "status": "healthy",
  "classification_authority": "supervisor_server_derived",
  "worker_count": 1,
  "workers": [
    {
      "worker_id": "arc-worker-001",
      "role": "general_office_arc_worker",
      "capabilities": ["document_read"],
      "state": "healthy",
      "authenticated": true,
      "eligible": true,
      "worker_version": "arc-bot-shell-0.1.0",
      "last_heartbeat_at": "2026-07-26T01:00:00Z",
      "control_plane_status": "acknowledged",
      "guardian_decision_id": "guardian-decision-001",
      "lima_decision_id": "lima-decision-001",
      "lima_status": "allowed_dry_run",
      "assignment_status": "acknowledged",
      "evidence_refs": ["event-001"],
      "reason_codes": [],
      "runtime_authority_blocked": true,
      "executable": false,
      "execution_allowed": false,
      "side_effects_allowed": false
    }
  ],
  "evidence_refs": ["event-001"],
  "reason_codes": [],
  "runtime_authority_blocked": true,
  "executable": false,
  "execution_allowed": false,
  "side_effects_allowed": false
}
